{
    "schema_version": "handoff-sidecar-v1",
    "dispatch_id": "ISSUE-40",
    "packet_type": "EXEC",
    "author": "Executor / Claude",
    "timestamp": "2026-05-19_07-35-42+0300",
    "related_files": [
                          "crates/cad-projection/tests/face_picking_smoke.rs — newline style normalized from CRLF to LF (no semantic edits)"
                      ],
    "status": "AWAITING_REVIEW",
    "handoff_status": "COMPLETE",
    "next_role": "REVIEWER_AI",
    "exit_code": 0
}