{
    "schema_version": "handoff-sidecar-v1",
    "dispatch_id": "ISSUE-73",
    "packet_type": "CORRECT",
    "author": "Planner / OpenAI Codex",
    "timestamp": "2026-05-20T18:35:13+03:00",
    "related_files": [
                          "crates/editor-ui/tests/phase8_graph_diff_smoke.rs"
                      ],
    "status": "CORRECTION_OPEN",
    "handoff_status": "COMPLETE",
    "next_role": "EXECUTOR_AI",
    "exit_code": 0
}