{
    "schema_version": "handoff-sidecar-v1",
    "dispatch_id": "ISSUE-98",
    "packet_type": "TASK",
    "author": "Planner / OpenAI Codex",
    "timestamp": "2026-05-22_23-21-00+0300",
    "related_files": [
                          "crates/io-image/**",
                          "crates/io-image/src/asset_store_stub.rs",
                          "crates/io-image/src/lib.rs",
                          "crates/io-image/src/image_data.rs",
                          "crates/asset-store/**",
                          "crates/asset-store/src/cache.rs",
                          "crates/io-gltf/src/asset_store_cache.rs",
                          "ai_handoffs/ISSUE-98_EXEC_*.md"
                      ],
    "status": "OPEN",
    "handoff_status": "COMPLETE",
    "next_role": "EXECUTOR_AI",
    "exit_code": 0
}