{
    "schema_version": "handoff-sidecar-v1",
    "dispatch_id": "POSTV0-HANDOFF-ARTIFACT-TRIAGE-004",
    "packet_type": "TASK",
    "author": "Planner / OpenAI Codex",
    "timestamp": "2026-05-16_09-27-22+0300",
    "related_files": [
                          "ai_handoffs/",
                          ".ai/",
                          "OPENAItoCLAUDE_*.md",
                          "CLAUDEtoOPENAI_*.md",
                          "JobsDone_*.md",
                          "CLAUDE_SUB_EPSILON_REVIEW.md",
                          "new-handoff.ps1"
                      ],
    "status": "OPEN",
    "handoff_status": "COMPLETE",
    "next_role": "EXECUTOR_AI",
    "exit_code": 0
}