{
    "schema_version": "handoff-sidecar-v1",
    "dispatch_id": "ISSUE-342",
    "packet_type": "EXEC",
    "author": "Executor / OpenAI Codex",
    "timestamp": "2026-06-08_16-37-07+0300",
    "related_files": [
                          "crates/editor-egui-host/src/menu.rs",
                          "crates/editor-egui-host/src/menu_tests.rs",
                          "plans/BASELINE.md",
                          "Status.md",
                          "HANDOFF.md",
                          "change.md",
                          ".ai/dispatch.tasks.md",
                          "ai_handoffs/ISSUE-342_TASK_2026-06-08_16-20-42+0300.md",
                          "ai_handoffs/ISSUE-342_EXEC_2026-06-08_16-37-07+0300.md",
                          "ai_handoffs/ISSUE-342_EXEC_2026-06-08_16-37-07+0300.meta.json"
                      ],
    "status": "AWAITING_REVIEW",
    "handoff_status": "COMPLETE",
    "next_role": "REVIEWER_AI",
    "exit_code": 0
}
