{
    "schema_version": "handoff-sidecar-v1",
    "dispatch_id": "ISSUE-56",
    "packet_type": "TASK",
    "author": "Planner / OpenAI Codex",
    "timestamp": "2026-05-20_01-32-15+0300",
    "related_files": [
                          "crates/material-graph/src/lib.rs",
                          "kernel/graph-foundation/src/invalidation.rs",
                          "kernel/graph-foundation/src/graph.rs"
                      ],
    "status": "OPEN",
    "handoff_status": "COMPLETE",
    "next_role": "EXECUTOR_AI",
    "exit_code": 0
}