{
    "schema_version": "handoff-sidecar-v1",
    "dispatch_id": "ISSUE-412",
    "packet_type": "TASK",
    "author": "Planner / OpenAI Codex",
    "timestamp": "2026-06-16_01-44-25+0300",
    "related_files": [
                          ".ai/dispatch.tasks.md",
                          "ai_handoffs/ISSUE-411_TASK_2026-06-16_00-54-49+0300.md",
                          "ai_handoffs/ISSUE-411_EXEC_2026-06-16_01-08-02+0300.md",
                          "crates/editor-shell/src/lifecycle/commands.rs",
                          "crates/editor-shell/src/lifecycle/tests.rs",
                          "crates/editor-shell/src/lifecycle/mod.rs",
                          "crates/cad-projection/src/lib.rs",
                          "crates/cad-projection/src/render_adapter.rs",
                          "crates/cad-projection/src/projection_structural/mod.rs",
                          "Status.md",
                          "HANDOFF.md",
                          "plans/BASELINE.md",
                          "change.md"
                      ],
    "status": "OPEN",
    "handoff_status": "COMPLETE",
    "next_role": "EXECUTOR_AI",
    "exit_code": 0
}