{
    "schema_version": "handoff-sidecar-v1",
    "dispatch_id": "ISSUE-29",
    "packet_type": "CORRECT",
    "author": "Planner / OpenAI Codex",
    "timestamp": "2026-05-19_00-59-04+0300",
    "related_files": [
                          "crates/cad-core/tests/fillet_brep_chain_resolution_smoke.rs"
                      ],
    "status": "CORRECTION_OPEN",
    "handoff_status": "COMPLETE",
    "next_role": "EXECUTOR_AI",
    "exit_code": 0
}