{
    "schema_version": "handoff-sidecar-v1",
    "dispatch_id": "ISSUE-16",
    "packet_type": "CORRECT",
    "author": "Planner / OpenAI Codex",
    "timestamp": "2026-05-18T10:03:05+03:00",
    "related_files": [
                          "crates/gfx/tests/wgsl_parse_smoke.rs"
                      ],
    "status": "CORRECTION_OPEN",
    "handoff_status": "COMPLETE",
    "next_role": "EXECUTOR_AI",
    "exit_code": 0
}