{
    "schema_version": "handoff-sidecar-v1",
    "dispatch_id": "ISSUE-64",
    "packet_type": "EXEC",
    "author": "Executor / Claude",
    "timestamp": "2026-05-20_11-44-15+0300",
    "related_files": [
                          "crates/editor-ui/tests/phase8_graph_diff_smoke.rs — new integration test"
                      ],
    "status": "AWAITING_REVIEW",
    "handoff_status": "COMPLETE",
    "next_role": "REVIEWER_AI",
    "exit_code": 0
}