{
    "schema_version": "handoff-sidecar-v1",
    "dispatch_id": "ISSUE-411",
    "packet_type": "EXEC",
    "author": "Executor / Codex",
    "timestamp": "2026-06-16_01-08-02+0300",
    "related_files": [
                          "crates/editor-shell/src/lifecycle/commands.rs - added the tracked-CAD stale-id cleanup helper and shared BRep liveness predicate",
                          "crates/editor-shell/src/lifecycle/tests.rs - added focused helper tests for fresh, live, and stale tracked-CAD states",
                          ".ai/dispatch.tasks.md - marked task 156 consumed and appended exactly one gated audit task 157"
                      ],
    "status": "AWAITING_REVIEW",
    "handoff_status": "COMPLETE",
    "next_role": "REVIEWER_AI",
    "exit_code": 0
}