{
    "schema_version": "handoff-sidecar-v1",
    "dispatch_id": "ISSUE-210",
    "packet_type": "EXEC",
    "author": "Executor / Claude",
    "timestamp": "2026-05-26_15-22-29+0300",
    "related_files": [
                          "ai_handoffs/ISSUE-210_TASK_2026-05-26_15-11-47+0300.md — read-only audit basis (TASK packet)",
                          "plans/PLAN.md — read; freeze policy + gates (§0.6, §1.4, §1.15, §13.15, §13.16, §14)",
                          "plans/IMPLEMENTATION.md — read; Phase 9 production-pressure axes (§9)",
                          "Status.md — read (lines 1, 9–15, 115–127, 200–203, 225–241, 370–373)",
                          "HANDOFF.md — read (lines 1–20, 83–98, 1473–1582)",
                          "change.md — read (lines 1–25, 1625–1634, plus tail summary)",
                          "Cargo.toml — read (workspace members lines 1–140)",
                          "crates/, kernel/, editor/, runtime/, tools/ — directory listing only",
                          "crates/editor-state/src/ — file listing only; inspector_snapshot.rs head read",
                          "crates/editor-egui-host/Cargo.toml — read"
                      ],
    "status": "AWAITING_REVIEW",
    "handoff_status": "COMPLETE",
    "next_role": "REVIEWER_AI",
    "exit_code": 0
}