{
    "schema_version": "handoff-sidecar-v1",
    "dispatch_id": "ISSUE-50",
    "packet_type": "TASK",
    "author": "Planner / OpenAI Codex",
    "timestamp": "2026-05-19_17-18-44+0300",
    "related_files": [
                          "crates/anim-graph/src/lib.rs",
                          "crates/anim-graph/Cargo.toml"
                      ],
    "status": "OPEN",
    "handoff_status": "COMPLETE",
    "next_role": "EXECUTOR_AI",
    "exit_code": 0
}