{
    "schema_version": "handoff-sidecar-v1",
    "dispatch_id": "ISSUE-34",
    "packet_type": "TASK",
    "author": "Planner / OpenAI Codex",
    "timestamp": "2026-05-19_03-23-48+0300",
    "related_files": [
                          "crates/cad-projection/tests/render_adapter_smoke.rs",
                          "crates/cad-projection/tests/sweep_brep_face_id_lookup_smoke.rs",
                          "crates/cad-projection/src/render_adapter.rs"
                      ],
    "status": "OPEN",
    "handoff_status": "COMPLETE",
    "next_role": "EXECUTOR_AI",
    "exit_code": 0
}